sutra_no,sutra,transliteration_kn,transliteration_hi,transliteration_en,meaning_en,meaning_hi,meaning_kn,tellmemore_en_adv,tellmemore_en_dva,tellmemore_en_vis,tellmemore_kn_adv,tellmemore_kn_dva,tellmemore_kn_vis,tellmemore_hi_adv,tellmemore_hi_dva,tellmemore_hi_vis
5,"यन्मनसा न मनुते येनाहुर्मनो मतम्‌।
तदेव ब्रह्म त्वं विद्धि नेदं यदिदमुपासते ॥ ||५||","ಯನ್ಮನಸಾ ನ ಮನುತೇ ಯೇನಾಹುರ್ಮನೋ ಮತಮ್।
ತದೇವ ಬ್ರಹ್ಮ ತ್ವಂ ವಿದ್ಧಿ ನೇದಂ ಯದಿದಮುಪಾಸತೇ ॥ ||೫||","यन्मनसा न मनुते येनाहुर्मनो मतम्‌।
तदेव ब्रह्म त्वं विद्धि नेदं यदिदमुपासते ॥ ||५||","yanmanasā na manute yenāhurmano matam‌।
tadeva brahma tvaṃ viddhi nedaṃ yadidamupāsate ॥ ||5||","The eye does not go there, nor does the speech, nor does the mind
We do not know or understand how this should be taught.
Other than that known and then unknown.
We have heard this from our ancestors who explained it to us.","जो मन नहीं समझता, उसके द्वारा वे कहते हैं कि मन समझता है।
तुम्हें यह जानना चाहिए कि यह परम सत्य है, न कि वह जिसकी वे पूजा करते हैं।","ಮನಸ್ಸು ಗ್ರಹಿಸದಿರುವುದನ್ನು, ಅದರಿಂದ ಮನಸ್ಸು ಗ್ರಹಿಸಲ್ಪಟ್ಟಿದೆ ಎಂದು ಅವರು ಹೇಳುತ್ತಾರೆ.
ಇದು ಪರಮ ಸತ್ಯ, ಅವರು ಪೂಜಿಸುವುದಲ್ಲ ಎಂದು ನೀವು ತಿಳಿದುಕೊಳ್ಳಬೇಕು. ||೫||","This verse describes the true nature of the Self (Atman). It explains that the Self is steady and unchanging, yet it is faster than the mind. The senses, like sight and hearing, cannot catch up to it because it is always ahead of them. Even though it doesn't move, it surpasses everything else that moves. This is because the Self is present everywhere and in everything.

Shankara clarifies that the Self doesn't change or move, but it seems to be everywhere because it reflects in everything we perceive. The mind is considered the fastest because it can think of distant places instantly. However, the Self is already there even before the mind can think of it.

The verse also mentions Matariśva, which means the Mukya-Prana, symbolizing the vital force that sustains life. This force, guided by the Self, supports all activities in the universe. The Self remains constant and eternal, making everything else function.

In simpler terms, the Self is the ultimate reality that is constant and everywhere. It moves faster than the mind because it is beyond physical movement. The senses can't perceive it directly because it is beyond them. This Self supports all life and activities in the universe.","In Dvaita philosophy, this verse describes the nature of the Supreme God, emphasizing His immanence and transcendence. It highlights several key attributes of God. First, God is unmoved and fearless, indicating His supreme stability and absence of fear. He is also described as one, the ultimate and supreme being. Although deities and other beings cannot fully grasp or comprehend Him due to His infinite nature, He knows all from the beginning of time.

God is faster than the mind, suggesting His omnipresence and omniscience, able to surpass all thoughts and actions. Despite others running fast, He effortlessly overtakes them, symbolizing His supreme power and presence everywhere.

Mukhya-prana, the chief vital force, plays a crucial role by offering the deeds of all beings to God. This signifies that all actions performed by individuals are ultimately dedicated to and evaluated by God. It highlights the concept that humans are instruments of God, and their actions are a form of worship and devotion aimed at obtaining God's grace.

Understanding these characteristics helps devotees realize that God is the true doer, and by dedicating their actions to Him, they align themselves with divine will and purpose. This realization constitutes the essence of ""samarpana"" or offering at the feet of God, acknowledging His supreme authority and seeking His blessings.","This sloka highlights the unique and extraordinary nature of Paramatman (Supreme Self) in Vishishtadvaita philosophy. Paramatman is described as ""Anejat,"" meaning unmoving, yet swifter than the mind. This paradoxical nature signifies that while Paramatman is changeless and steady, He transcends the speed and capabilities of the mind. 

The ""Devas"" or gods, representing various divine forces, cannot fully comprehend Him despite their swift nature because their knowledge is obstructed by Karma. The term ""Ayeti Tishthat"" suggests that Paramatman, residing as the inner self of all, remains stationary yet overtakes all entities that move. This implies His omnipresence and omnipotence, overseeing and regulating all activities in the universe.

Moreover, ""Matarishva"" (the Mukya Prana) symbolically carries out its duties by the will of Paramatman, indicating that even natural forces operate under His command. The verse thus underscores the supreme and all-encompassing power of God, who is both immanent and transcendent, providing the foundation and support for all existence. This realization leads to a deeper understanding of the divine presence within and outside, encouraging devotees to seek His grace and guidance.",,,,"जो चलनेवाला न हो उसे 'अनेजत्' कहते हैं, क्योंकि 'एज कम्पने' [ इस धातुसूत्र से ] 'एज्'
धातुका अर्थ कम्पन है । इस
प्रकार [ वह आत्मतत्त्व ] कम्पन -
चलन अर्थात् अपनी अवस्थासे च्युत
होनेसे रहित है यानी सदा एक रूप है । वह एक ही सब प्राणियों में वर्तमान है । तथा सङ्कल्पादिरूप | मनसे भी जवीय - अधिक वेगवान् है । पूर्व 0 - ० - यह विरुद्ध बात कैसे कही जाती है कि वह आत्मतत्त्व ध्रुव एवं निश्चल है तथा मनसे भी अधिक वेगवान् है ?
सिद्धान्ती - यह कोई दोष नहीं है, क्योंकि निरुपाधिक और सोपाधिकरूपसे यह विरुद्ध कथन
भी बन सकता है । उस अवस्थामें 1 अपने निरुपाधिकरूपसे तो 'अविचल ' और 'एक' - ऐसा कहा जाता है तथा अन्तःकरणकी मनरूप संकल्प- विकल्पात्मिका उपाधिका अनुवर्तन करनेके कारण [ मनसे भी अधिक वेगवान् कहा गया है ] इस लोक- में देहस्थ मनका ब्रह्मलोक आदि दूर देशोंमें संकल्परूपसे एक क्षणमें ही गमन हो जाता है; अतः मन- का अत्यन्त वेगतत्त्व तो लोकमें प्रसिद्ध ही है । किन्तु उस मनके ब्रह्मलोकादि में बड़ी शीघ्रतासे पहुँचने- पर वहाँ आत्मचैतन्यका अवभास पहलेहीसे पहुँचा हुआ-सा अनुभव किया जाता है । इसीसे वह मनसे भी अधिक वेगवान् है' ऐसा श्रुति कहती है।
जिसका प्रकरण चल रहा ऐसे इस आत्मतत्त्वको देवगण भी प्राप्त अर्थात् उपलब्ध नहीं कर सके । विषयका द्योतन ( प्रकाश) करनेके कारण चक्षु आदि इन्द्रियाँ ही 'देव' हैं । उन इन्द्रियोंसे तो मन ही वेगवान् है; अतः [ आत्मा तथा इन्द्रियोंके बीच में] मनोव्यापारका
व्यवधान रहनेके कारण आत्माका तो आभासमात्र भी इन्द्रियोंका विषय
नहीं होता ।
क्योंकि आकाशके समान व्यापक होनेके कारण वह वेगवान् मनसे भी पहले ही गया हुआ है । वह सर्व- व्यापी आत्मतत्त्व अपने निरुपाधिक
स्वरूपसे सम्पूर्ण संसार - धर्मोसे रहित तथा अविक्रिय होकर ही
उपाधिकृत सम्पूर्ण सांसारिक
विकारोंको अनुभव करता है और
अविवेकी मूढ़ पुरुषोंको प्रत्येक शरीर-
में अनेक - सा प्रतीत होता है इसीसे
श्रुति ने ऐसा कहा है ।
वह दौड़ते अर्थात् तेजी से चलते हुए, आत्मासे भिन्न अन्य मन, वाणी और इन्द्रिय आदिका अतिक्रमण कर जाता है— मानो उन्हें पार करके चला जाता है । 'इव' का भावार्थ श्रुति 'तिष्ठत् ' ( ठहरनेवाला ) इस पद से स्वयं ही दिखला रही है । अर्थात् स्वयं अधिकारी रहकर ही दूसरोंको पार कर जाता है । उस नित्यचैतन्यस्वरूप आत्म-
तत्त्वके वर्तमान रहते हुए ही, जो मातरि अर्थात् अन्तरिक्षमें सवार - गमन करता है वह मातरिश्वा - वायु, जो समस्त प्राणोंका पोषक और क्रियारूप है, जिसके अधीन ये सारे शरीर और इन्द्रिय हैं तथा जिसमें ये
सब ओतप्रोत हैं और जो सूत्रसंज्ञक
तत्त्व निखिल जगत्का विधाता है वह मातरिश्वा अप् अर्थात् प्राणियों - के चेष्टारूप कर्म यानी अग्नि, सूर्य और मेघ आदिके ज्वलन - दहन, प्रकाशन एवं वर्षारम्भादि कर्म विभक्त करता है । ऐसा इसका भावार्थ है ।
अथवा ""इसके भयसे वायु चलता
है"" इत्यादि [ भाववाली ] श्रुतियोंके अनुसार 'दधाति' का अर्थ 'धारण करता है' ऐसा जानो। क्योंकि शरीर और इन्द्रिय आदि सभी विकार सबके अधिष्ठानस्वरूप नित्य- चैतन्य आत्मतत्त्वके विद्यमान रहते ही होते हैं ॥ ४ ॥",,
6,"तदे॑जति॒ तन्नै॑जति॒ तद्दू॒रे तद्व॑न्ति॒के ।

तद॒न्तर॑स्य॒ सर्व॑स्य॒ तदु॒ सर्व॑स्यास्य बाह्य॒तः ॥५॥","ತದೇಜತಿ ತನ್ನೈಜತಿ ತದ್ದೂರೇ ತದ್ವಂತಿಕೇ ।
ತದಂತರಸ್ಯ​ ಸರ್ವಸ್ಯ ತದು ಸರ್ವಸ್ಯಾಸ್ಯ ಬಾಹ್ಯತಃ ॥ ೫ ॥","तदे॑जति॒ तन्नै॑जति॒ तद्दू॒रे तद्व॑न्ति॒के ।

तद॒न्तर॑स्य॒ सर्व॑स्य॒ तदु॒ सर्व॑स्यास्य बाह्य॒तः ॥५॥","yaccakṣuṣā na paśyati yena cakṣūṃṣi paśyati।
tadeva brahma tvaṃ viddhi nedaṃ yadidamupāsate ॥ ||6||
","That which the mind does not perceive, by which they say that the mind is perceived.
You should know that this is the Absolute Truth, not that which they worship.","जो वह अपनी आँखों से नहीं देखता, उसे वह अपनी आँखों से देखता है।
तुम्हें यह जानना चाहिए कि यह परम सत्य है, न कि वह जिसकी वे पूजा करते हैं।","ಅವನು ತನ್ನ ಕಣ್ಣುಗಳಿಂದ ಏನನ್ನು ನೋಡುವುದಿಲ್ಲವೋ, ಅದರ ಮೂಲಕ ಅವನು ತನ್ನ ಕಣ್ಣುಗಳಿಂದ ನೋಡುತ್ತಾನೆ.
ಇದು ಪರಮ ಸತ್ಯ, ಅವರು ಪೂಜಿಸುವುದಲ್ಲ ಎಂದು ನೀವು ತಿಳಿದುಕೊಳ್ಳಬೇಕು. ||೬||","In Advaita philosophy, this verse emphasizes the unique and all-encompassing nature of the Self (Atman). The Self is unmoving and constant, yet it appears to move because it is present in all moving entities. It seems far away to those who are ignorant of its true nature, but it is very near to those who realize it, as it is their innermost essence. The Self is inside everything, being the core of all beings and objects. At the same time, it is outside everything, pervading the entire universe like space. This illustrates the non-dualistic view of Advaita, where the Self is the singular, all-pervasive reality that transcends and includes all existence. It unites everything in a continuous, unbroken presence, highlighting the oneness of all life and existence.","In Dvaita philosophy, this verse emphasizes the omnipresence and omnipotence of God. It conveys that God is the supreme authority whom everything in existence respects and fears. This is because all beings are dependent on Him, while He is independent and fears none.

The verse further describes God's omnipresence by stating that He is both near and far. This means that God is close to us, within our hearts, and also far-reaching, extending beyond the physical universe. His presence is not limited by space or distance, making Him simultaneously accessible and transcendent.

Additionally, God is described as being inside and outside all. He resides within every being, regulating and guiding their actions. At the same time, He exists outside, supporting and sustaining the entire creation. This dual aspect highlights His role as the inner controller and the external sustainer of the universe.

These descriptions illustrate God's infinite nature through paradoxes, showing that He encompasses all opposites and transcends all limitations. His presence and power are absolute, making Him the ultimate source of fear, respect, and reverence.","The verse describes the enigmatic nature of the Supreme Being, portraying it as both dynamic and static, distant and proximate, internal and external. In Vishishtadvaita philosophy, this signifies God's omnipresence and transcendence.

For those ignorant and attached to sensory pleasures, God seems distant, highlighting their spiritual separation from the divine. Conversely, to the devoted who focus their minds on Govinda (Vishnu) and renounce worldly desires, God appears near, illustrating the intimacy and accessibility of the divine through devotion and detachment.

This verse underscores that God pervades all existence, being both immanent within creation and transcendent beyond it. It emphasizes that the perception of God's proximity is determined by one's spiritual awareness and devotion. By recognizing this dual nature, believers are encouraged to seek a deeper connection with the divine, understanding that God is always present, both within and beyond the visible world. This recognition leads to a profound spiritual realization that transcends ordinary perception, inviting a closer, more personal relationship with the divine essence that permeates everything.",,,,"जिसका प्रकरण है वह आत्मतत्त्व एजन करता — चलता है, वही स्वयं नहीं भी चलता, अर्थात् स्वयं अचल रहकर ही चलता हुआ-सा जान पड़ता है। यही नहीं, वह दूर भी है; अज्ञानियोंको सैकड़ों करोड़ वर्षोंमें भी अप्राप्य होनेके कारण दूर- जैसा है । [ ' तद्वन्तिके' का ] तत् उ अन्ति- के ऐसा पदच्छेद करना चाहिये । वही अन्तिक - अत्यन्त समीप भी है अर्थात् केवल दूर ही नहीं, विद्वानोंका आत्मा होनेके कारण समीप भी है । वह इस सबके अन्तर यानी भीतर भी है, जैसा कि ""जो आत्मा सर्वान्तर हैं"" इत्यादि श्रुतिसे सिद्ध होता है । आकाशके समान व्यापक होनेके कारण वह इस नामरूप और क्रियात्मक सम्पूर्ण जगत् के बाहर तथा सूक्ष्मरूप होनेसे इसके भीतर भी है। और श्रुतिके ""प्रज्ञानघन ही है"" इस कथन के अनुसार वह निरन्तर ( बाहर- भीतरके भेदको त्यागकर सर्वत्र ) ही है ॥ ५ ॥",,
